{
  "schemaVersion": 1,
  "kind": "chain-summary",
  "toolVersion": "0.4.0",
  "snapshot": {
    "chainId": "example-chain",
    "chainVersion": "1.0.0",
    "entries": [
      {
        "entryId": "11111111111111111111111111111111",
        "sourcePath": "D:/rules/policy-0.json",
        "rulesetIdentity": null,
        "errorCode": "missing-ruleset",
        "errorMessage": "Selected ruleset is unavailable."
      },
      {
        "entryId": "22222222222222222222222222222222",
        "sourcePath": "D:/rules/policy-1.json",
        "rulesetIdentity": {
          "id": "policy-1",
          "version": "1.0.0",
          "sha256": "0000000000000000000000000000000000000000000000000000000000000000",
          "path": "D:/rules/policy-1.json"
        },
        "errorCode": null,
        "errorMessage": null
      }
    ],
    "target": {
      "root": "D:/fixture"
    },
    "build": {
      "mode": "existing",
      "configuration": "Debug",
      "assemblyPaths": [],
      "allowNetwork": false,
      "sources": []
    },
    "inputIdentity": {
      "sha256": "0000000000000000000000000000000000000000000000000000000000000000",
      "files": []
    },
    "buildInputIdentity": {
      "sha256": "0000000000000000000000000000000000000000000000000000000000000000",
      "files": []
    },
    "outputDirectory": "D:/reports/example-run",
    "targetKind": "fixture"
  },
  "execution": "partial",
  "compliance": "inconclusive",
  "exitCode": 4,
  "projectCount": 1,
  "entries": [
    {
      "entryId": "11111111111111111111111111111111",
      "execution": "failed",
      "compliance": "inconclusive",
      "exitCode": 2,
      "reportDirectory": "11111111111111111111111111111111",
      "diagnostic": {
        "schemaVersion": 1,
        "kind": "chain-entry-diagnostic",
        "entryId": "11111111111111111111111111111111",
        "code": "missing-ruleset",
        "message": "Selected ruleset is unavailable."
      },
      "coverage": {
        "projectCount": 1,
        "assemblyCount": 0,
        "sourceBound": false
      },
      "binding": "none",
      "ruleResults": [],
      "findings": [],
      "limitations": []
    },
    {
      "entryId": "22222222222222222222222222222222",
      "execution": "completed",
      "compliance": "compliant",
      "exitCode": 0,
      "reportDirectory": "22222222222222222222222222222222/child-run",
      "diagnostic": null,
      "coverage": {
        "projectCount": 1,
        "assemblyCount": 0,
        "sourceBound": false
      },
      "binding": "none",
      "ruleResults": [
        {
          "ruleId": "same-rule-id",
          "status": "pass",
          "matched": 1,
          "findingIds": [],
          "limitations": []
        }
      ],
      "findings": [],
      "limitations": []
    }
  ],
  "limitations": [],
  "runMetadata": {
    "runId": "example-run",
    "startedUtc": "2026-10-09T00:00:00Z",
    "elapsedMilliseconds": 0,
    "targetRoot": "D:/fixture"
  }
}
